{
  "contract_version": "0.1-draft",
  "event_id": "aaaaaaaa-aaaa-4aaa-8aaa-aaaaaaaaaaaa",
  "source_system": "invicta",
  "shared_producer_id": "11111111-1111-4111-8111-111111111111",
  "shared_field_id": "22222222-2222-4222-8222-222222222222",
  "resource_id": "bbbbbbbb-bbbb-4bbb-8bbb-bbbbbbbbbbbb",
  "resource_type": "harvest",
  "resource_revision": 1,
  "base_revision": 0,
  "boundary_revision": 3,
  "occurred_at": "2026-10-21T18:00:00Z",
  "operation": "upsert",
  "payload": {
    "name": "mapas_colheita",
    "integration_name": "mapas_colheita",
    "season": "2026/2027",
    "method": "Exemplo artificial; não representa medição real",
    "status": "available",
    "value_unit": "t/ha",
    "geometry": {
      "type": "FeatureCollection",
      "features": [
        {
          "type": "Feature",
          "id": "cccccccc-cccc-4ccc-8ccc-cccccccccccc",
          "properties": {
            "value": 3.2,
            "quality": "synthetic_example"
          },
          "geometry": {
            "type": "Polygon",
            "coordinates": [
              [
                [
                  -50.0,
                  -24.0
                ],
                [
                  -50.0,
                  -24.0005
                ],
                [
                  -49.9995,
                  -24.0005
                ],
                [
                  -49.9995,
                  -24.0
                ],
                [
                  -50.0,
                  -24.0
                ]
              ]
            ]
          }
        }
      ]
    },
    "quantity": "grain_yield",
    "crop": "soybean",
    "nodata": null
  }
}