{
  "contract_version": "0.1-draft",
  "event_id": "77777777-7777-4777-8777-777777777777",
  "source_system": "invicta",
  "shared_producer_id": "11111111-1111-4111-8111-111111111111",
  "shared_field_id": "22222222-2222-4222-8222-222222222222",
  "resource_id": "88888888-8888-4888-8888-888888888888",
  "resource_type": "management_zones",
  "resource_revision": 1,
  "base_revision": 0,
  "boundary_revision": 3,
  "occurred_at": "2026-10-21T18:00:00Z",
  "operation": "upsert",
  "payload": {
    "name": "zonas_manejo",
    "integration_name": "zonas_manejo",
    "season": "2026/2027",
    "semantic": "productivity_class",
    "method": "informar método da Invicta",
    "status": "consolidated",
    "value_unit": "class",
    "geometry": {
      "type": "FeatureCollection",
      "features": [
        {
          "type": "Feature",
          "id": "99999999-9999-4999-8999-999999999999",
          "properties": {
            "zone_id": "Z1",
            "class_label": "Alta",
            "value": 3
          },
          "geometry": {
            "type": "Polygon",
            "coordinates": [
              [
                [
                  -50.0,
                  -24.0
                ],
                [
                  -50.0,
                  -24.0005
                ],
                [
                  -49.9995,
                  -24.0005
                ],
                [
                  -49.9995,
                  -24.0
                ],
                [
                  -50.0,
                  -24.0
                ]
              ]
            ]
          }
        }
      ]
    }
  }
}